{
  "schemaVersion": "1.0",
  "storyId": "shravana-baskets",
  "sourceVersion": 2,
  "sourceBlobSha1": "ff7d726c4aad1b11c363ba78cf561006d1b793ae",
  "status": "in-review",
  "locale": "ta-IN",
  "language": "ta",
  "register": "ஒரு நொடி அவசரத்தில் நடந்த திரும்ப முடியாத விபத்தை அமைதியாகச் சொல்லி, மரணத்தை ரசிக்காமல், பின்னர் தசரதனின் மகன் பிரிவு மரணத்தோடு இணைப்பைத் தெளிவாக வைத்திருக்கும் தமிழ்.",
  "title": "இரண்டு கூடைகளில் பெற்றோரைச் சுமந்த ஸ்ரவணன்",
  "tease": "கண் தெரியாத பெற்றோரை காவடி போன்ற இரண்டு கூடைகளில் வைத்து ஸ்ரவணன் புண்ணிய இடங்களுக்கு எடுத்துச் சென்றான். ஒரு இரவு ஆற்றில் தண்ணீர் எடுக்கும் சத்தத்தை இளம் தசரதன் யானை என்று நினைத்தான்—யோசனை முடியும் முன் அம்பு பறந்தது.",
  "displayNames": {
    "Śravaṇa": "ஸ்ரவணன்",
    "Daśaratha": "தசரதன்",
    "Rāma": "ராமர்"
  },
  "sourceMap": {
    "tease": [
      0,
      1,
      2
    ],
    "scenes": {
      "skill": [
        0
      ],
      "journey": [
        1
      ],
      "river": [
        2,
        3
      ],
      "after": [
        3,
        4
      ],
      "parents": [
        4,
        5
      ],
      "frame": [
        6
      ],
      "landing": [
        0,
        2,
        3,
        4,
        5,
        6
      ]
    },
    "parentNote": [
      2,
      3,
      4,
      5,
      6
    ],
    "traditionNote": [
      0,
      1,
      2,
      3,
      4,
      5,
      6
    ],
    "ifTheyAsk": [
      [
        0,
        2,
        3,
        4
      ],
      [
        4,
        5
      ],
      [
        6
      ]
    ]
  },
  "lengths": {
    "short": {
      "measuredSeconds": null,
      "blocks": [
        {
          "t": "p",
          "scene": "skill",
          "text": "இளம் «Daśaratha» ஒரு திறமையில் பெருமை கொண்டவன்: இருட்டில் சத்தம் மட்டும் கேட்டு அம்பு எய்ய முடியும். ஆற்றங்கரையில் காத்திருந்து குடிக்கும் சத்தம் கேட்டால் பார்க்காமலே இலக்கை அடிக்க முடியும்."
        },
        {
          "t": "p",
          "scene": "journey",
          "text": "அதே பகுதியில் கண் தெரியாத பெற்றோரும் அவர்களின் மகன் ஸ்ரவணனும் இருந்தார்கள். ஸ்ரவணன் ஒரு காவடி போல கம்பின் இரு முனைகளிலும் கூடை கட்டி, பெற்றோரை புண்ணியத் தலங்களுக்கு தோளில் சுமந்து சென்றான். வழியிலுள்ள காட்சிகளையும் விவரித்தான்."
        },
        {
          "t": "beat",
          "scene": "river"
        },
        {
          "t": "p",
          "scene": "river",
          "text": "ஒரு இரவு பெற்றோருக்கு தாகம். ஸ்ரவணன் குடம் எடுத்துக் கொண்டு ஆற்றுக்கு இறங்கினான்."
        },
        {
          "t": "p",
          "scene": "river",
          "text": "ஒரு காலியான பாத்திரத்தில் தண்ணீர் நிரம்பும் சத்தம் தசரதனுக்குக் கேட்டது. _யானை_, என்று நினைத்தான். தன் வேகத்தில் மிகுந்த நம்பிக்கை; எண்ணம் முழுமையாவதற்கு முன் நாணை விட்டுவிட்டான்."
        },
        {
          "t": "p",
          "scene": "river",
          "text": "கேட்ட குரல் யானையின் குரல் இல்லை."
        },
        {
          "t": "beat",
          "scene": "after"
        },
        {
          "t": "p",
          "scene": "after",
          "text": "தசரதன் குரல் வந்த இடத்துக்கு ஓடினான். மறைந்து போகவில்லை; காலை வரை காத்திருக்கவில்லை. ஆற்றங்கரையில் ஸ்ரவணன்; அருகே விழுந்த குடம். தண்ணீர் எடுக்க வந்த இளைஞனை அம்பு தாக்கியிருந்தது."
        },
        {
          "t": "p",
          "scene": "after",
          "text": "ஸ்ரவணனால் இன்னும் பேச முடிந்தது. _உங்கள்மீது கோபமில்லை. என் அம்மா அப்பா காலை முதல் தண்ணீர் குடிக்கவில்லை; அவர்கள் என்னைத் தேடி வர முடியாது. குடம் நிரப்புங்கள். அவர்களிடம் நீங்களே சென்று சொல்லுங்கள்,_ என்றான்."
        },
        {
          "t": "beat",
          "scene": "parents"
        },
        {
          "t": "p",
          "scene": "parents",
          "text": "தசரதன் தண்ணீர் எடுத்துச் சென்று கண் தெரியாத பெற்றோரிடம் உண்மையைச் சொன்னான். பேசுவதற்கு முன்பே காலடிச் சத்தம் தங்கள் மகனுடையது அல்ல என்று அவர்கள் அறிந்திருந்தார்கள்."
        },
        {
          "t": "p",
          "scene": "parents",
          "text": "ஸ்ரவணனின் தந்தை, _நான் மகன் பிரிவால் இறப்பது போல நீயும் மகன் பிரிவால் இறப்பாய்,_ என்றார். வால்மீகியின் காட்சியில் அது கத்தும் பழிவாங்கலைவிட துயரில் சோர்ந்த மனிதன் சொல்லும் எதிர்காலச் சொல் போல இருக்கிறது."
        },
        {
          "t": "beat",
          "scene": "frame"
        },
        {
          "t": "p",
          "scene": "frame",
          "text": "பல ஆண்டுகளுக்குப் பிறகு «Rāma» பதினான்கு ஆண்டு காட்டுக்குச் சென்றார்; தசரதன் இரண்டு வாரம்கூட உயிரோடு இருக்கவில்லை. இந்தப் பழைய கதையை சொல்லுபவர் வெளிப்புற கதையாளர் அல்ல—இறக்கும் தசரதனே அதை நினைத்து தன் மனைவியிடம் சொல்கிறான்."
        },
        {
          "t": "slow",
          "scene": "landing",
          "text": "ஒரு நொடி அவசரத்தை தசரதனால் வாழ்நாளில் திரும்பப் பெற முடியவில்லை. ஆனால் கதை அவனை ஓடிவிடுபவனாக அல்ல, தண்ணீர் எடுத்துச் சென்று உண்மையைச் சொல்ல வேண்டிய மனிதனாகவும் காட்டுகிறது."
        }
      ]
    }
  },
  "parentNote": "8+ மற்றும் மிகவும் சோகமான கதை. ஒரு இளைஞன் விபத்தில் அம்பால் இறக்கிறான்; காயத்தின் விவரம் இல்லை. கண் தெரியாத பெற்றோரிடம் தசரதன் நேராகச் செய்தியைச் சொல்கிறான். பெற்றோர் முதலில் வாசித்து பிறகு குழந்தையுடன் பகிர்வது நல்லது.",
  "traditionNote": "வால்மீகி ராமாயணம் அயோத்தி காண்டம் 63–64-ல் இறக்கும் தசரதன் இந்த இளமைச் சம்பவத்தைச் சொல்கிறான்: சத்தம் கேட்டு அம்பு எய்யும் திறமை, தண்ணீர் எடுக்கும் ஸ்ரவணனை யானை என்று தவறாக நினைத்தல், பெற்றோரிடம் தண்ணீரும் உண்மையும் கொண்டு செல்வது, பின்னர் மகன் பிரிவால் இறப்பாய் என்ற தந்தையின் சொல். இது ராமரின் வனவாசத்துக்கான காரணம் அல்ல; தசரதன் அதைத் தாங்க முடியாத பின்னணி.",
  "close": {
    "question": "ஸ்ரவணனின் பெற்றோர் யாத்திரை செல்ல விரும்பினர்; அவன் காவடியை தூக்கிக் கொண்டான். உனக்காக யாராவது எந்தப் பாரத்தைத் தூக்கியிருக்கிறார்கள்?",
    "seed": "நாம் நடக்க கற்றுக்கொள்ளும் முன்பே யாரோ ஒருவரால் தூக்கப்பட்டவர்கள்.",
    "ifTheyAsk": [
      {
        "q": "தசரதன் கெட்ட மனிதனா?",
        "a": "கதை அவனை அப்படிச் சுருக்கவில்லை. இளம் வயதில் தன் வேகத்தில் பெருமைப்பட்டு ஒரு நொடியில் திரும்ப முடியாத தவறு செய்கிறான். ஆனால் ஓடிப்போகவில்லை; ஸ்ரவணனிடம் செல்கிறான், தண்ணீர் கொண்டு செல்கிறான், பெற்றோரிடம் தானே உண்மையை சொல்கிறான்."
      },
      {
        "q": "அவர்கள் மன்னிக்கவில்லையா?",
        "a": "பிற்காலக் கதைகள் அதை கடும் சாபமாகச் சொல்லலாம். வால்மீகியின் காட்சியில் தந்தை மிகுந்த துயரில், தானும் மகன் பிரிவால் இறப்பதுபோல் தசரதனும் இறப்பான் என்று சொல்வது போலத் தோன்றுகிறது."
      },
      {
        "q": "இதனால் தான் ராமர் காடு போனாரா?",
        "a": "இல்லை. ராமர் காடு போவது கைகேயிக்கு தசரதன் கொடுத்த பழைய வரங்களால். ஸ்ரவணன் சம்பவம் ராமரின் பிரிவால் தசரதன் ஏன் உயிர் தாங்கவில்லை என்பதுடன் தொடர்புடையது; காரணம் வேறு."
      }
    ]
  },
  "review": {
    "nativeReadAloud": {
      "short": {
        "status": "pending",
        "reviewer": null,
        "reviewedOn": null
      }
    },
    "languageEditor": {
      "status": "pending",
      "reviewer": null,
      "reviewedOn": null
    },
    "sourceFidelity": {
      "status": "pending",
      "reviewer": null,
      "reviewedOn": null
    }
  }
}
