{
  "schemaVersion": "1.0",
  "storyId": "sundarar-court",
  "sourceVersion": 1,
  "sourceBlobSha1": "a891f50f3ec0250cfe6e415ac97a612b23f08d03",
  "locale": "hi-IN",
  "language": "hi",
  "status": "approved",
  "register": "सहज, आत्मीय हिन्दी; कथा सुनाने की लय में, पुराने सामाजिक ढाँचे को बिना छिपाए और बिना सही ठहराए।",
  "title": "शादी रोकने वाला पुराना ताड़पत्र",
  "tease": "विवाह शुरू होने ही वाला है। तभी एक वृद्ध ताड़पत्र दिखाकर कहता है कि दूल्हा उसके लिए सेवा करने को बँधा है। मामला सभा तक पहुँचता है।",
  "displayNames": {
    "Sundarar": "सुंदरर",
    "Śiva": "भगवान शिव"
  },
  "sourceMap": {
    "tease": [
      0,
      1,
      2
    ],
    "scenes": {
      "wedding": [
        0,
        1
      ],
      "court": [
        2,
        3
      ],
      "temple": [
        4
      ],
      "song": [
        5,
        6
      ],
      "landing": [
        3,
        4,
        5,
        6
      ]
    },
    "parentNote": [
      0,
      2,
      3
    ],
    "traditionNote": [
      0,
      5,
      6
    ],
    "ifTheyAsk": [
      [
        0,
        2,
        3
      ],
      [
        2,
        3,
        4
      ],
      [
        5,
        6
      ]
    ]
  },
  "lengths": {
    "short": {
      "measuredSeconds": 180,
      "blocks": [
        {
          "t": "p",
          "scene": "wedding",
          "text": "«Sundarar» विवाह के लिए बैठे थे। तभी एक वृद्ध ब्राह्मण मंडप में आया और बोला कि शादी से पहले एक पुराना दावा निपटना चाहिए।"
        },
        {
          "t": "p",
          "scene": "wedding",
          "text": "उसने ताड़पत्र दिखाकर कहा कि «Sundarar» के दादा ने अपने वंशजों की सेवा का वचन लिखा था। सुंदरर ने प्रति छीनकर फाड़ दी। वृद्ध ने कहा कि असली पत्र तिरुवेण्णैनल्लूर की सभा में दिखाया जाएगा।"
        },
        {
          "t": "beat",
          "scene": "court"
        },
        {
          "t": "p",
          "scene": "court",
          "text": "सभा ने बात को केवल इसलिए नहीं माना कि कोई वृद्ध कह रहा था। उसने असली पत्र देखा, प्रश्न पूछे और दादा की दूसरी लिखावट से तुलना की।"
        },
        {
          "t": "p",
          "scene": "court",
          "text": "लिखावट मेल खाती थी। सभा ने वृद्ध के पक्ष में निर्णय दिया। «Sundarar» जिस दावे को असंभव समझ रहे थे, वही मुकदमा हार गए।"
        },
        {
          "t": "p",
          "scene": "court",
          "text": "पुराने दस्तावेज़ की भाषा आज हमें असहज लगनी चाहिए। यह कथा मनुष्य की गुलामी को सही नहीं ठहराती; संत-जीवनी पुराने कानूनी रूप से भगवान के प्रति सेवा का संबंध दिखाती है।"
        },
        {
          "t": "beat",
          "scene": "temple"
        },
        {
          "t": "p",
          "scene": "temple",
          "text": "वृद्ध से उसका घर दिखाने को कहा गया। वह लोगों को मंदिर तक ले गया और भीतर जाकर गायब हो गया। तब कथा बताती है कि वह «Śiva» थे।"
        },
        {
          "t": "p",
          "scene": "song",
          "text": "उन्होंने «Sundarar» से तमिल में गाने को कहा। झगड़े में सुंदरर ने वृद्ध को पागल कहा था। अब उसी संबोधन से पहला पद शुरू करने को कहा गया।"
        },
        {
          "t": "p",
          "scene": "song",
          "text": "सुंदरर का तिरुवेण्णैनल्लूर तेवारम् सचमुच ‘पित्ता’ से शुरू होता है। गीत पुराना पाठ-साक्ष्य है; अदालत की पूरी कथा बाद की पेरियपुराणम् जीवनी से आती है।"
        },
        {
          "t": "slow",
          "scene": "landing",
          "text": "वे विवाह मंडप में अपना रास्ता तय समझकर बैठे थे; मुकदमा हारकर निकले तो उनकी पहली कविता का रास्ता खुल चुका था।"
        }
      ]
    },
    "full": {
      "measuredSeconds": 360,
      "blocks": [
        {
          "t": "p",
          "scene": "wedding",
          "text": "विवाह का मंडप तैयार था। «Sundarar» दूल्हे के रूप में बैठे थे और परिवार उनके चारों ओर था। तभी एक वृद्ध ब्राह्मण ने आकर सबको सुनने को कहा।"
        },
        {
          "t": "p",
          "scene": "wedding",
          "text": "उसका दावा था कि विवाह से पहले एक पुराना मामला निपटना चाहिए। उसके अनुसार सुंदरर के दादा ने लिखित रूप में अपने वंशजों की सेवा का वचन दिया था।"
        },
        {
          "t": "p",
          "scene": "wedding",
          "text": "«Sundarar» क्रोधित हुए। उन्होंने ताड़पत्र की प्रति माँगी, उसे फाड़ दिया और दावे को असंभव कहा। वृद्ध ने जवाब दिया कि असली दस्तावेज़ तिरुवेण्णैनल्लूर की सभा में रखा है।"
        },
        {
          "t": "beat",
          "scene": "court"
        },
        {
          "t": "p",
          "scene": "court",
          "text": "सभा ने मामले को गंभीरता से लिया। उसने पूछा कि ऐसा वंशानुगत सेवा-दावा कैसे स्वीकार किया जा सकता है और प्रमाण माँगा।"
        },
        {
          "t": "p",
          "scene": "court",
          "text": "वृद्ध ने असली ताड़पत्र पेश किया। सभा ने केवल उम्र देखकर भरोसा नहीं किया; दादा की दूसरी ज्ञात लिखावट मँगाकर दोनों की तुलना की।"
        },
        {
          "t": "p",
          "scene": "court",
          "text": "लिखावट मेल खाती थी। सभा ने दस्तावेज़ को मान लिया और वृद्ध के पक्ष में निर्णय दिया। «Sundarar» को उसके साथ जाना पड़ा।"
        },
        {
          "t": "p",
          "scene": "court",
          "text": "इस हिस्से की भाषा आज पढ़ते समय कठोर लगती है, और उसे नरम करके छिपाना ठीक नहीं होगा। पेरियपुराणम् पुराने सेवा-दावे का उपयोग भगवान से संबंध दिखाने के लिए करता है; मनुष्य की गुलामी का समर्थन नहीं करता।"
        },
        {
          "t": "beat",
          "scene": "temple"
        },
        {
          "t": "p",
          "scene": "temple",
          "text": "सभा ने वृद्ध से उसका घर दिखाने को कहा। वह मंदिर की ओर चला और «Sundarar» पीछे गए। भीतर पहुँचते ही वृद्ध दिखाई देना बंद हो गया।"
        },
        {
          "t": "p",
          "scene": "temple",
          "text": "यहीं संत-कथा भेष खोलती है। विवाह रोकने वाला और मुकदमा जीतने वाला वृद्ध «Śiva» थे। उन्होंने कहा कि सुंदरर को अपनी सेवा में बुलाने आए थे।"
        },
        {
          "t": "beat",
          "scene": "song"
        },
        {
          "t": "p",
          "scene": "song",
          "text": "अब «Śiva» ने सुंदरर से तमिल में स्तुति गाने को कहा। सुंदरर को आरंभ नहीं सूझा। झगड़े में उन्होंने वृद्ध के लिए ‘पागल’ का संबोधन इस्तेमाल किया था।"
        },
        {
          "t": "p",
          "scene": "song",
          "text": "«Śiva» ने कहा कि उसी शब्द से शुरू करो। सुंदरर का पहला तिरुवेण्णैनल्लूर पद ‘पित्ता’ से खुलता है और चंद्रकलाधारी भगवान को पुकारता है।"
        },
        {
          "t": "p",
          "scene": "song",
          "text": "यहाँ दो स्रोत-परतें अलग रखना ज़रूरी है। तेवारम् 7.1 सुंदरर की पुरानी काव्य-आवाज़ है। पूरा मुकदमा और मंदिर-प्रकाशन बाद की पेरियपुराणम् संत-जीवनी है।"
        },
        {
          "t": "p",
          "scene": "landing",
          "text": "कथा का मोड़ यह नहीं कि अदालत ने मानव गुलामी को सही सिद्ध किया। संत-जीवनी के भीतर मोड़ यह है कि दूल्हा, जो अपना जीवन तय समझ रहा था, एक दूसरे प्रकार की सेवा के लिए बुलाया जाता है।"
        },
        {
          "t": "slow",
          "scene": "landing",
          "text": "जिस बहस को वे जीतना चाहते थे, उसी में हारकर «Sundarar» उस गीत तक पहुँचे जिससे परंपरा आज भी उन्हें पहचानती है।"
        }
      ]
    }
  },
  "parentNote": "कथा में वंशानुगत सेवा का पुराना कानूनी रूप है। इसे मानव गुलामी की स्वीकृति की तरह न सुनाएँ; स्रोत की असहज भाषा को छिपाएँ भी नहीं।",
  "traditionNote": "मुकदमे की विस्तृत कथा बाद की तमिल शैव पेरियपुराणम् जीवनी से आती है। सुंदरर का ‘पित्ता’ से शुरू होने वाला तेवारम् पद पुराना प्रथम-पुरुष काव्य-साक्ष्य है।",
  "close": {
    "question": "जब तुम्हें पूरा विश्वास हो कि सामने वाला गलत है, तब प्रमाण तुम्हारे खिलाफ़ जाए तो सबसे कठिन क्या होगा?",
    "seed": "कभी-कभी मोड़ वहीं शुरू होता है जहाँ हमारी निश्चितता खत्म होती है।",
    "ifTheyAsk": [
      {
        "q": "क्या इसका मतलब गुलामी सही थी?",
        "a": "नहीं। पेरियपुराणम् पुराने सेवा-दावे की भाषा को भगवान से संबंध का रूप देता है। हम उस भाषा को छिपाते नहीं, लेकिन मानव गुलामी का समर्थन भी नहीं बनाते।"
      },
      {
        "q": "क्या सभा को धोखा दिया गया?",
        "a": "संत-कथा में सभा प्रश्न पूछती है, असली ताड़पत्र देखती है और लिखावट मिलाती है। उसके बाद ही निर्णय होता है; दिव्य पहचान मंदिर में प्रकट होती है।"
      },
      {
        "q": "क्या सुंदरर ने सच में शिव को ‘पागल’ कहा?",
        "a": "पेरियपुराणम् यही कारण बताता है कि पहला पद ‘पित्ता’ से शुरू हुआ। तेवारम् 7.1 का पहला पद सचमुच उसी संबोधन से खुलता है; कारण बताने वाली अदालत-कथा बाद की जीवनी है।"
      }
    ]
  },
  "review": {
    "nativeReadAloud": {
      "short": {
        "status": "approved",
        "reviewer": "rama",
        "reviewedOn": "2026-10-03"
      },
      "full": {
        "status": "approved",
        "reviewer": "rama",
        "reviewedOn": "2026-10-03"
      }
    },
    "languageEditor": {
      "status": "approved",
      "reviewer": "rama",
      "reviewedOn": "2026-10-02"
    },
    "sourceFidelity": {
      "status": "approved",
      "reviewer": "rama",
      "reviewedOn": "2026-10-02"
    }
  }
}
