{
  "schemaVersion": "1.0",
  "storyId": "maitreyi-wealth",
  "sourceVersion": 2,
  "sourceBlobSha1": "8c44b3f4bd45ba1f23b07b7937d85833900217ad",
  "status": "in-review",
  "locale": "hi-IN",
  "language": "hi",
  "register": "सहज, आत्मीय हिन्दी; धन को अच्छा-बुरा ठहराने के बजाय उसकी सीमा पर मैत्रेयी के सटीक प्रश्न को केंद्र में रखने वाली भाषा।",
  "title": "मैत्रेयी ने पूछा—क्या इससे मैं अमर हो जाऊँगी?",
  "tease": "याज्ञवल्क्य घर छोड़ने से पहले संपत्ति बाँटना चाहते थे। मैत्रेयी ने हिस्सा कितना मिलेगा यह नहीं पूछा। उनका प्रश्न था: पूरी पृथ्वी धन से भरकर मेरी हो जाए, तो क्या वह मुझे अमर कर सकती है?",
  "displayNames": {
    "Maitreyi": "मैत्रेयी",
    "Yājñavalkya": "याज्ञवल्क्य",
    "Kātyāyanī": "कात्यायनी"
  },
  "sourceMap": {
    "tease": [
      0,
      1
    ],
    "scenes": {
      "offer": [
        0
      ],
      "question": [
        1
      ],
      "turn": [
        2
      ],
      "teaching": [
        3
      ],
      "parallel": [
        4
      ],
      "landing": [
        1,
        2,
        3
      ]
    },
    "parentNote": [
      0,
      1,
      2
    ],
    "traditionNote": [
      0,
      1,
      2,
      3,
      4
    ],
    "ifTheyAsk": [
      [
        1,
        2
      ],
      [
        1,
        3
      ],
      [
        1,
        2
      ]
    ]
  },
  "lengths": {
    "short": {
      "measuredSeconds": null,
      "blocks": [
        {
          "t": "p",
          "scene": "offer",
          "text": "«Yājñavalkya» गृहस्थ जीवन छोड़ने की तैयारी कर रहे थे। उन्होंने कहा कि घर की संपत्ति «Maitreyi» और «Kātyāyanī» के बीच बाँट देंगे।"
        },
        {
          "t": "p",
          "scene": "question",
          "text": "मैत्रेयी ने यह नहीं पूछा कि उनका हिस्सा कितना होगा. उन्होंने सवाल को बहुत बड़ा कर दिया: _मान लीजिए पूरी पृथ्वी धन से भरी हुई मेरी हो जाए—क्या उससे मैं अमर हो जाऊँगी?_"
        },
        {
          "t": "p",
          "scene": "question",
          "text": "याज्ञवल्क्य ने सीधा उत्तर दिया: _नहीं._ धन तुम्हें धनवान व्यक्ति का जीवन दे सकता है. लेकिन जिस अमरत्व की तुम बात कर रही हो, वह उससे नहीं मिलेगा."
        },
        {
          "t": "beat",
          "scene": "turn"
        },
        {
          "t": "p",
          "scene": "turn",
          "text": "मैत्रेयी ने धन को बुरा नहीं कहा. उन्होंने पूछा: _जो चीज़ मुझे वह नहीं दे सकती जिसे मैं खोज रही हूँ, उसका मैं क्या करूँ? आप जो जानते हैं, वह मुझे सिखाइए._"
        },
        {
          "t": "p",
          "scene": "turn",
          "text": "याज्ञवल्क्य को यह प्रश्न प्रिय लगा. बातचीत वहीं से बदल गई—संपत्ति बाँटने से आत्मा, प्रेम और अमरत्व की शिक्षा की ओर."
        },
        {
          "t": "p",
          "scene": "teaching",
          "text": "आगे वे कहते हैं कि पति, पत्नी, पुत्र, धन, देवता और संसार हमें अपने-आप में अंतिम कारण से प्रिय नहीं होते; आत्मा के कारण प्रिय होते हैं. आत्मा को सुनना, उस पर विचार करना और समझना चाहिए."
        },
        {
          "t": "beat",
          "scene": "landing"
        },
        {
          "t": "p",
          "scene": "landing",
          "text": "इस छोटी कहानी में मुख्य बात पूरी शिक्षा नहीं, वह दरवाज़ा है जिससे शिक्षा खुलती है. मैत्रेयी किसी चीज़ की कीमत उसके आकार से नहीं, उसके काम से जाँचती हैं."
        },
        {
          "t": "p",
          "scene": "landing",
          "text": "थोड़ा धन नहीं—पूरी पृथ्वी का धन. अगर तब भी सवाल का उत्तर _नहीं_ है, तो ज्यादा मात्रा माँगने से जवाब नहीं बदलेगा."
        },
        {
          "t": "slow",
          "scene": "landing",
          "text": "मैत्रेयी ने यह नहीं पूछा कि धन अच्छा है या बुरा. उन्होंने पूछा: _क्या यह उस प्रश्न का उत्तर दे सकता है जो मेरे सामने है?_"
        }
      ]
    }
  },
  "parentNote": "कठिन दृश्य नहीं है. संवाद में गृहस्थ जीवन छोड़ना और संपत्ति बाँटना आता है. इसे धन-विरोधी कहानी की तरह न पढ़ें; मैत्रेयी का प्रश्न यह है कि धन एक खास लक्ष्य—अमरत्व—दे सकता है या नहीं.",
  "traditionNote": "बृहदारण्यक उपनिषद 2.4 में याज्ञवल्क्य का संपत्ति बाँटने का प्रस्ताव, मैत्रेयी का _पूरी पृथ्वी धन से भर जाए तो क्या मैं अमर होऊँगी?_ वाला प्रश्न, _नहीं_ का उत्तर और ज्ञान की माँग आती है. यही संवाद 4.5 में फिर मिलता है.",
  "close": {
    "question": "अगर तुम्हारे पास अपनी पसंद की हर चीज़ खरीदने की ताक़त हो, तो ऐसी कौन-सी चीज़ है जो फिर भी खरीदी नहीं जा सकती?",
    "seed": "किसी चीज़ का मूल्य होना और हर काम कर पाना एक ही बात नहीं है.",
    "ifTheyAsk": [
      {
        "q": "क्या मैत्रेयी को धन से नफ़रत थी?",
        "a": "नहीं. उनका प्रश्न बहुत सटीक है: क्या सारी पृथ्वी का धन भी अमरत्व दे सकता है? जब उत्तर नहीं मिलता है, तब वे उस ज्ञान को माँगती हैं जो उनके असली प्रश्न से जुड़ा है."
      },
      {
        "q": "यहाँ अमरत्व का मतलब क्या है?",
        "a": "संवाद साधारण संपत्ति और साधारण जीवन से आगे टिकने वाली चीज़ के बारे में पूछता है. इसी प्रश्न से याज्ञवल्क्य आत्मा की बड़ी शिक्षा शुरू करते हैं."
      },
      {
        "q": "तो क्या कहानी कहती है कि पैसा बेकार है?",
        "a": "नहीं. याज्ञवल्क्य कहते हैं कि धन धनवान का जीवन दे सकता है. बस वह हर समस्या का उत्तर नहीं है. मैत्रेयी उसी सीमा को पहचानती हैं."
      }
    ]
  },
  "review": {
    "nativeReadAloud": {
      "short": {
        "status": "pending",
        "reviewer": null,
        "reviewedOn": null
      }
    },
    "languageEditor": {
      "status": "pending",
      "reviewer": null,
      "reviewedOn": null
    },
    "sourceFidelity": {
      "status": "pending",
      "reviewer": null,
      "reviewedOn": null
    }
  }
}
