{
  "schemaVersion": "1.0",
  "storyId": "parvati-decides",
  "sourceVersion": 2,
  "sourceBlobSha1": "8f1837f16cd217eb89d0aa59d1a8c11540e89440",
  "status": "approved",
  "locale": "hi-IN",
  "language": "hi",
  "register": "10+ के लिए चिंतनशील हिन्दी; पार्वती की दृढ़ता को केंद्र में रखते हुए उपवास को न अनुकरणीय तरीका बनाना, और पुराण व कालिदास की कविता की स्रोत-सीमा स्पष्ट रखना।",
  "title": "सबने पार्वती से कहा—कोई और रास्ता चुनो",
  "tease": "पार्वती ने तय किया कि वे शिव से विवाह करेंगी। परिवार, ऋषि, सबने समझाया—व्यावहारिक बनो। फिर एक युवा तपस्वी आया और शिव की बुराइयाँ गिनाने लगा। वह खुद शिव थे।",
  "displayNames": {
    "Pārvatī": "पार्वती",
    "Śiva": "शिव",
    "Himavat": "हिमवत",
    "Aparṇā": "अपर्णा"
  },
  "sourceMap": {
    "tease": [
      0,
      1,
      2,
      5,
      6,
      7,
      8
    ],
    "scenes": {
      "decision": [
        0,
        1,
        2
      ],
      "austerity": [
        3,
        4
      ],
      "disguise": [
        5,
        6,
        7,
        8
      ],
      "seam": [
        1,
        2,
        3,
        4,
        5,
        6,
        7,
        8
      ],
      "landing": [
        2,
        5,
        6,
        7
      ]
    },
    "parentNote": [
      2,
      3,
      4
    ],
    "traditionNote": [
      0,
      1,
      2,
      3,
      4,
      5,
      6,
      7,
      8
    ],
    "ifTheyAsk": [
      [
        5,
        6,
        7,
        8
      ],
      [
        3,
        4
      ],
      [
        0,
        1,
        2
      ]
    ]
  },
  "lengths": {
    "short": {
      "measuredSeconds": 360,
      "blocks": [
        {
          "t": "p",
          "scene": "decision",
          "text": "«Pārvatī» हिमालय-राज «Himavat» की बेटी थीं। बहुत कम उम्र में उन्होंने तय कर लिया कि वे «Śiva» से विवाह करेंगी।"
        },
        {
          "t": "p",
          "scene": "decision",
          "text": "उस समय यह सबको अव्यावहारिक लगा। शिव ध्यान में रहते थे, घर-दौलत की परवाह नहीं, सामाजिक जीवन की कोई इच्छा नहीं। परिवार और आने-जाने वाले ऋषियों ने पार्वती को समझाया—किसी और को चुनो।"
        },
        {
          "t": "p",
          "scene": "decision",
          "text": "उन्होंने सबकी बात सुनी और निर्णय नहीं बदला। वे पर्वत पर तप करने चली गईं।"
        },
        {
          "t": "beat",
          "scene": "austerity"
        },
        {
          "t": "p",
          "scene": "austerity",
          "text": "उनका तप बहुत कठोर बताया गया है—गर्मी, वर्षा, ठंड; भोजन कम करते-करते गिरे हुए पत्ते तक, फिर पत्ते भी नहीं। इसलिए एक नाम «Aparṇā»—जिसके पास पत्ता भी नहीं।"
        },
        {
          "t": "p",
          "scene": "austerity",
          "text": "यह बच्चों के लिए तरीका नहीं है। कहानी स्वयं माँ को उनसे रुकने की विनती करते दिखाती है। उपवास की नकल नहीं; उनकी अडिग इच्छा को पुरानी कविता सबसे तीव्र भाषा में नाप रही है।"
        },
        {
          "t": "beat",
          "scene": "disguise"
        },
        {
          "t": "p",
          "scene": "disguise",
          "text": "फिर एक युवा तपस्वी उनके पास बैठा और सहज स्वर में पूछा—यह सब किसके लिए? पार्वती ने शिव का नाम लिया।"
        },
        {
          "t": "p",
          "scene": "disguise",
          "text": "युवक ने शिव की सूची बनानी शुरू की: घर नहीं, धन नहीं, शरीर पर राख, साँप, श्मशान की संगति, परिवार का पता नहीं। मज़ाक भी था, तर्क भी।"
        },
        {
          "t": "p",
          "scene": "disguise",
          "text": "पार्वती ने हर बात का जवाब दिया। फिर उठकर चलने लगीं—शिव के बारे में और अपमान सुनना उन्हें मंज़ूर नहीं था।"
        },
        {
          "t": "p",
          "scene": "disguise",
          "text": "तभी भेष उतर गया। वह युवक शिव ही थे। अपनी ही बुराइयाँ गिनाने आए थे, यह देखने कि पार्वती का निर्णय किसी सुंदर कल्पना पर टिका है या पूरी आपत्ति सुनकर भी रहता है।"
        },
        {
          "t": "beat",
          "scene": "seam"
        },
        {
          "t": "p",
          "scene": "seam",
          "text": "यहाँ स्रोत का जोड़ साफ़ रखना जरूरी है। शिव पुराण पार्वती का निर्णय, लंबा तप और विवाह देता है। खुद शिव का भेष बदलकर अपनी निंदा करना कालिदास के कुमारसम्भव की अद्भुत काव्य-कथा है—शास्त्र का वही अध्याय नहीं।"
        },
        {
          "t": "slow",
          "scene": "landing",
          "text": "उन्हें सबने समझाया। अंत में वही व्यक्ति भेष बदलकर सबसे अच्छा विरोध-तर्क लेकर आया जिसे वे चुन चुकी थीं—और पार्वती उस तर्क के खत्म होने तक बैठी भी नहीं रहीं।"
        }
      ]
    }
  },
  "parentNote": "यह कहानी 10+ और अभिभावकीय सावधानी वाली है। पार्वती का तप भोजन लगभग छोड़ देने तक जाता है। इसे बच्चों के लिए दृढ़ता पाने का तरीका न कहें; शरीर को भूखा रखना अनुकरण योग्य नहीं। कथा का बिंदु निर्णय की दृढ़ता है, न खाने का अभ्यास। परिवार भी इसका विरोध करता है।",
  "traditionNote": "शिव पुराण रुद्र संहिता पार्वती खण्ड में पार्वती का शिव से विवाह का संकल्प, परिवार का विरोध, वर्षों का तप और विवाह आता है। शिव का युवा तपस्वी बनकर अपने ही दोष गिनाना कालिदास के कुमारसम्भव 5 से आता है। बाद की कथा-परंपरा दोनों को मिला देती है; यहाँ जोड़ का स्थान नाम से बताया गया है।",
  "close": {
    "question": "सब भरोसेमंद लोग कहें कि तुम गलत हो और तुम फिर भी न बदलो—तो कैसे पहचानोगे कि तुम जिद्दी हो या सच में निश्चित?",
    "seed": "किसी का तुम्हें समझा लेना और तुम्हारा गलत होना एक ही बात नहीं है।",
    "ifTheyAsk": [
      {
        "q": "शिव ने भेष क्यों बदला?",
        "a": "कुमारसम्भव का दृश्य उन्हें अपनी ही आलोचना का सबसे मजबूत वकील बनाता है। वह पार्वती के निर्णय को उस रूप में जाँचना चाहता है जहाँ आपत्ति कोई दुश्मन नहीं, एक शांत, बुद्धिमान अजनबी रखता है।"
      },
      {
        "q": "क्या पार्वती जैसा उपवास करना चाहिए?",
        "a": "नहीं। यह बच्चों या वयस्कों के लिए बिना चिकित्सकीय/धार्मिक संदर्भ के अनुकरणीय तरीका नहीं है। कथा स्वयं माँ को रोकने की विनती करते दिखाती है। पुरानी कविता उनकी दृढ़ता को अतिशय तप से मापती है।"
      },
      {
        "q": "क्या उनके माता-पिता अंत में मान गए?",
        "a": "हाँ, विवाह होता है। लेकिन पार्वती ने तर्क से उन्हें सीधे नहीं बदला; बाद में सप्तर्षि शिव की ओर से प्रस्ताव लेकर हिमवत के पास आते हैं और वह सहमत होते हैं।"
      }
    ]
  },
  "review": {
    "nativeReadAloud": {
      "short": {
        "status": "approved",
        "reviewer": "rama",
        "reviewedOn": "2026-09-22"
      }
    },
    "languageEditor": {
      "status": "approved",
      "reviewer": "rama",
      "reviewedOn": "2026-09-22"
    },
    "sourceFidelity": {
      "status": "approved",
      "reviewer": "rama",
      "reviewedOn": "2026-09-22"
    }
  }
}
