{
  "schemaVersion": "1.0",
  "storyId": "govardhana",
  "sourceVersion": 2,
  "sourceBlobSha1": "d3e3236fc682844e57158ce41b95b116f189db85",
  "status": "approved",
  "sourceMap": {
    "tease": [
      4,
      5
    ],
    "scenes": {
      "offering": [
        0
      ],
      "question": [
        1
      ],
      "govardhana": [
        2
      ],
      "storm": [
        3
      ],
      "lift": [
        4
      ],
      "shelter": [
        4
      ],
      "sticks": [
        5
      ],
      "seventh": [
        6
      ],
      "landing": [
        5,
        6
      ]
    },
    "parentNote": [
      3
    ],
    "traditionNote": [
      0,
      4,
      6
    ],
    "ifTheyAsk": [
      [
        3,
        6
      ],
      [
        4
      ]
    ]
  },
  "locale": "hi-IN",
  "language": "hi",
  "register": "सहज, आत्मीय हिन्दी; सुनाने की भाषा, न पाठ्यपुस्तक की, न अतिनाटकीय प्रवचन की।",
  "title": "वह पहाड़ जिसे सबने अपनी लाठियों से थामा",
  "tease": "सात साल के कृष्ण ने सात दिन तक पूरा पहाड़ छोटी उँगली पर उठा रखा। नीचे खड़े एक ग्वाले ने सोचा—बच्चा थक रहा होगा—और अपनी लाठी लगा दी।",
  "displayNames": {
    "Kṛṣṇa": "कृष्ण",
    "Vraja": "व्रज",
    "Indra": "इन्द्र",
    "Govardhana": "गोवर्धन"
  },
  "lengths": {
    "short": {
      "measuredSeconds": 360,
      "blocks": [
        {
          "t": "p",
          "scene": "offering",
          "text": "बरसात खत्म होने लगती, तो «Vraja» में हर साल एक बड़ी तैयारी होती। अन्न, दही, मक्खन—सब «Indra» के लिए, क्योंकि इन्द्र वर्षा के देवता थे और गाँव पीढ़ियों से उनका धन्यवाद करता आया था।"
        },
        {
          "t": "p",
          "scene": "question",
          "text": "उस साल सात साल के «Kṛṣṇa» ने बीच में एक सवाल रख दिया। _हमारी गायें घास कहाँ चरती हैं? पानी कहाँ से मिलता है? दोपहर की छाँव कौन देता है?_ जवाब हर बार एक ही था—«Govardhana»। _तो धन्यवाद पहाड़ को क्यों नहीं?_ "
        },
        {
          "t": "p",
          "scene": "govardhana",
          "text": "बड़ों ने बहस की। पुरानी रीति बदलना आसान नहीं था। फिर उन्होंने कृष्ण की बात मान ली। भोजन गोवर्धन को अर्पित हुआ, पूरा गाँव पहाड़ की परिक्रमा करने निकला, और गायें भी साथ चलीं।"
        },
        {
          "t": "beat",
          "scene": "storm"
        },
        {
          "t": "p",
          "scene": "storm",
          "text": "ऊपर इन्द्र को यह अच्छा नहीं लगा। उन्होंने ऐसे बादल भेजे जो बरसकर आगे नहीं बढ़े। पानी एक दिन गिरा, फिर दूसरा। हवा के साथ बारिश तिरछी पड़ती रही। गायों के पैर पानी में डूबने लगे, बछड़ों को उठाकर ले जाना पड़ा, छप्पर खुलने लगे।"
        },
        {
          "t": "p",
          "scene": "storm",
          "text": "डरे हुए लोग कृष्ण के पास भागे। डर के समय हम अक्सर उसी के पास जाते हैं जो उस क्षण डरता हुआ नहीं दिखता।"
        },
        {
          "t": "p",
          "scene": "lift",
          "text": "कृष्ण बारिश में गोवर्धन तक गए, हाथ पहाड़ के किनारे के नीचे लगाया और उसे उठा लिया। पूरा पहाड़—पेड़, पगडंडियाँ, ढलानें—जैसे किसी बड़े बर्तन का ढक्कन उठ गया हो। उन्होंने उसे बाएँ हाथ की छोटी उँगली पर थामा और कहा, _सब नीचे आ जाओ।_"
        },
        {
          "t": "p",
          "scene": "shelter",
          "text": "सब आ गए। गायें, बछड़े, बैलगाड़ियाँ, बच्चे, बुज़ुर्ग, कुत्ते और जितने बर्तन कोई साथ उठा सकता था। बाहर पानी गरज रहा था, पहाड़ के नीचे जमीन सूखी थी।"
        },
        {
          "t": "beat",
          "scene": "sticks"
        },
        {
          "t": "p",
          "scene": "sticks",
          "text": "तभी एक ग्वाले ने ऊपर देखा। सात साल का बच्चा पहाड़ उठाए खड़ा है। उसने सोचा, _थक गया होगा।_ उसने अपनी लाठी उठाई और पहाड़ के नीचे टिका दी—मदद के लिए।"
        },
        {
          "t": "p",
          "scene": "sticks",
          "text": "फिर दूसरे ने भी लाठी लगा दी। फिर तीसरे ने। थोड़ी देर में पूरा घेरा बन गया—कृष्ण छोटी उँगली पर पहाड़ थामे थे और ग्वाले अपनी-अपनी लाठियाँ लगाए पूरे विश्वास से साथ दे रहे थे।"
        },
        {
          "t": "p",
          "scene": "seventh",
          "text": "बारिश सात दिन चली। फिर इन्द्र ने उसे रोक दिया। कृष्ण तब तक रुके जब तक आख़िरी गाय भी बाहर नहीं निकल गई। उसके बाद गोवर्धन को ठीक वहीं रख दिया जहाँ वह पहले था।"
        },
        {
          "t": "p",
          "scene": "landing",
          "text": "कृष्ण ने किसी से यह नहीं कहा कि तुम्हारी लाठी की ज़रूरत नहीं थी। उन्होंने किसी का हाथ नीचे नहीं कराया, किसी की मदद को छोटा नहीं कहा।"
        },
        {
          "t": "slow",
          "scene": "landing",
          "text": "पहाड़ उठाना चमत्कार था। लेकिन मुझे सबसे सुंदर यह लगता है कि उन्होंने दूसरों को मदद करने दिया।"
        }
      ]
    }
  },
  "parentNote": "5 साल और उससे बड़े बच्चों के लिए। तेज़ बारिश, डरे हुए लोग और खतरे में पशु हैं, लेकिन चोट या हिंसा का वर्णन नहीं है। कहानी का तनाव आश्रय मिलने पर टिक जाता है।",
  "traditionNote": "यह प्रसंग भागवत पुराण 10.24–25 में है और विष्णु पुराण तथा हरिवंश में भी लगभग इसी रूप में मिलता है। वार्षिक इन्द्र-पूजा, गोवर्धन को अर्पण, सात दिन की वर्षा, कृष्ण का बाएँ हाथ की छोटी उँगली पर पहाड़ उठाना और ग्वालों का अपनी लाठियाँ लगाना—ये सब पुराने स्रोतों में हैं; लाठियों वाला दृश्य बाद की सजावट नहीं है।",
  "close": {
    "question": "कृष्ण चाहें तो कह सकते थे—_लाठियाँ नीचे रखो, मैं संभाल रहा हूँ।_ तुम्हें क्या लगता है, उन्होंने ऐसा क्यों नहीं कहा?",
    "seed": "कभी-कभी किसी को अपनी मदद करने देना भी एक तरह की दया होती है।",
    "ifTheyAsk": [
      {
        "q": "तो क्या इन्द्र बुरे थे?",
        "a": "नहीं—और यह बात साफ़ कहना ठीक है। इन्द्र इतने समय से धन्यवाद पाते आए थे कि उन्होंने यह जाँचना छोड़ दिया कि उस सम्मान को उन्होंने कमाया भी है या नहीं। यह राक्षस बनने की बात नहीं; ताकतवर व्यक्ति के गलत होने का बहुत साधारण तरीका है। बच्चे इसे अक्सर तुरंत पहचान लेते हैं—कई बार किसी ऐसे बड़े में जिसे वे जानते हैं। कहानी में इन्द्र अंततः वर्षा रोकते हैं।"
      },
      {
        "q": "क्या सचमुच कोई बच्चा पहाड़ उठा सकता है?",
        "a": "कहानी में हाँ। यह दृश्य रोज़मर्रा की घटना की रिपोर्ट बनने की कोशिश नहीं करता। वह जान-बूझकर बहुत बड़ी चीज़ और बहुत छोटे बच्चे को एक ही तस्वीर में रखता है, ताकि फर्क दिखे। तुम चाहो तो बच्चे से उल्टा पूछ सकते हो—तुम्हारे लिए किसी ने अब तक सबसे भारी क्या उठाया है?"
      }
    ]
  },
  "review": {
    "nativeReadAloud": {
      "short": {
        "status": "approved",
        "reviewer": "rama",
        "reviewedOn": "2026-09-17"
      }
    },
    "languageEditor": {
      "status": "approved",
      "reviewer": "rama",
      "reviewedOn": "2026-09-17"
    },
    "sourceFidelity": {
      "status": "approved",
      "reviewer": "rama",
      "reviewedOn": "2026-09-17"
    }
  }
}
